CREATE EXTENSION pg_iot16;
CREATE TABLE pg_iot16_tab (a int) USING pg_iot16;
SELECT * FROM pg_iot16_tab;
 a 
---
(0 rows)

INSERT INTO pg_iot16_tab VALUES (1);
SELECT * FROM pg_iot16_tab;
 a 
---
 1
(1 row)

UPDATE pg_iot16_tab SET a = 0 WHERE a = 1;
ERROR:  pg_iot16: pgiot16_tuple_update: cannot UPDATE an pgiot16 table
SELECT * FROM pg_iot16_tab;
 a 
---
 1
(1 row)

DELETE FROM pg_iot16_tab WHERE a = 1;
ERROR:  pg_iot16: pgiot16_tuple_delete: cannot DELETE from an pgiot16 table
SELECT * FROM pg_iot16_tab;
 a 
---
 1
(1 row)

--
create table t(c int) using pg_iot16;
create index i on t(c);
ERROR:  only heap AM is supported
insert into t select generate_series(1, 1000000);
delete from t;
ERROR:  pg_iot16: pgiot16_tuple_delete: cannot DELETE from an pgiot16 table
update t set c=3 where c=999999;
ERROR:  pg_iot16: pgiot16_tuple_update: cannot UPDATE an pgiot16 table
select * from t where c = 555555;
   c    
--------
 555555
(1 row)

-- ALTER TABLE SET ACCESS METHOD
ALTER TABLE pg_iot16_tab SET ACCESS METHOD heap;
ERROR:  Cannot change access method for pgiot16 am
SELECT * FROM pg_iot16_tab;
 a 
---
 1
(1 row)

update pg_iot16_tab set a=1;
ERROR:  pg_iot16: pgiot16_tuple_update: cannot UPDATE an pgiot16 table
-- Clean up
DROP TABLE pg_iot16_tab;
